{
  "version": "2.0.0",
  "system": "yeolsal v2 — Oxblood Editorial",
  "lastUpdated": "2026-05-13",

  "color": {
    "bg": {
      "canvas":   { "oklch": "oklch(14% 0.006 30)",         "hex": "#1B1715" },
      "surface":  { "oklch": "oklch(18% 0.008 30)",         "hex": "#241F1C" },
      "elevated": { "oklch": "oklch(22% 0.010 30)",         "hex": "#2D2724" },
      "overlay":  { "oklch": "oklch(8% 0.004 30 / 0.78)",   "hex": "#100D0BC8" },
      "inverse":  { "oklch": "oklch(96% 0.005 60)",         "hex": "#F4F0EB" }
    },
    "text": {
      "primary":   { "oklch": "oklch(96% 0.005 60)", "hex": "#F4F0EB" },
      "secondary": { "oklch": "oklch(72% 0.008 60)", "hex": "#B7B0A6" },
      "tertiary":  { "oklch": "oklch(52% 0.008 60)", "hex": "#7B756B" },
      "disabled":  { "oklch": "oklch(35% 0.005 60)", "hex": "#504C46" },
      "inverse":   { "oklch": "oklch(18% 0.008 30)", "hex": "#241F1C" }
    },
    "key": {
      "default": { "oklch": "oklch(42% 0.135 25)", "hex": "#7E2C2A" },
      "glow":    { "oklch": "oklch(50% 0.155 25)", "hex": "#9B3633" },
      "deep":    { "oklch": "oklch(32% 0.110 22)", "hex": "#5E2120" },
      "muted":   { "oklch": "oklch(38% 0.045 25)", "hex": "#5B3A39" },
      "line":    { "oklch": "oklch(58% 0.140 25)", "hex": "#B14342" }
    },
    "ember": {
      "default": { "oklch": "oklch(72% 0.130 65)", "hex": "#D89F62" },
      "subtle":  { "oklch": "oklch(60% 0.075 65)", "hex": "#A48064" }
    },
    "stroke": {
      "subtle":  { "oklch": "oklch(28% 0.006 30)", "hex": "#3B3633" },
      "default": { "oklch": "oklch(40% 0.008 30)", "hex": "#594E48" },
      "strong":  { "oklch": "oklch(60% 0.010 30)", "hex": "#8A7C72" },
      "key":     { "oklch": "oklch(58% 0.140 25)", "hex": "#B14342" }
    },
    "chart": {
      "primary": { "oklch": "oklch(42% 0.135 25)", "hex": "#7E2C2A" },
      "muted":   { "oklch": "oklch(52% 0.008 60)", "hex": "#7B756B" },
      "grid":    { "oklch": "oklch(28% 0.006 30)", "hex": "#3B3633" }
    }
  },

  "semantic": {
    "survival": {
      "ACTIVE": {
        "color":           { "oklch": "oklch(58% 0.090 145)", "hex": "#6B9A6E" },
        "label":           "활동 중",
        "icon":            "check.bold",
        "grass-treatment": "vivid"
      },
      "YELLOW": {
        "color":           { "oklch": "oklch(70% 0.110 90)",  "hex": "#B89C4F" },
        "label":           "노란 카드",
        "icon":            "triangle.alert",
        "grass-treatment": "muted"
      },
      "RED": {
        "color":           { "oklch": "oklch(48% 0.085 25)",  "hex": "#7C4640" },
        "label":           "빨간 카드",
        "icon":            "diamond.pause",
        "grass-treatment": "ghosted"
      },
      "SPECTATOR": {
        "color":           { "oklch": "oklch(48% 0.020 240)", "hex": "#6E737E" },
        "label":           "관전 중",
        "icon":            "circle.half",
        "grass-treatment": "monochrome"
      }
    }
  },

  "typography": {
    "caption.sm":    { "size": 11, "lineHeight": 16, "weight": 400 },
    "caption":       { "size": 12, "lineHeight": 18, "weight": 400 },
    "body.sm":       { "size": 14, "lineHeight": 22, "weight": 400 },
    "body":          { "size": 16, "lineHeight": 26, "weight": 400 },
    "body.lg":       { "size": 18, "lineHeight": 30, "weight": 400 },
    "label":         { "size": 14, "lineHeight": 20, "weight": 600 },
    "label.lg":      { "size": 16, "lineHeight": 22, "weight": 700 },
    "heading.sm":    { "size": 20, "lineHeight": 28, "weight": 700 },
    "heading":       { "size": 24, "lineHeight": 32, "weight": 700 },
    "heading.lg":    { "size": 32, "lineHeight": 40, "weight": 800 },
    "display.sm":    { "size": 40, "lineHeight": 48, "weight": 800 },
    "display":       { "size": 56, "lineHeight": 64, "weight": 900 },
    "display.serif": { "size": 56, "lineHeight": 64, "weight": 700, "family": "Nanum Myeongjo" },
    "tracking": {
      "tight":  "-0.02em",
      "normal": "0em",
      "wide":   "0.06em"
    }
  },

  "space": {
    "0":  0,
    "1":  4,
    "2":  8,
    "3":  12,
    "4":  16,
    "5":  20,
    "6":  24,
    "8":  32,
    "10": 40,
    "12": 48,
    "16": 64,
    "24": 96,
    "layout": { "padding": 20 }
  },

  "radius": {
    "none":       0,
    "subtle":     6,
    "default":    10,
    "pronounced": 14,
    "pill":       9999
  },

  "elevation": {
    "0": "none",
    "1": "0 1px 2px rgba(0,0,0,0.4), 0 2px 4px rgba(0,0,0,0.2)",
    "2": "0 4px 12px rgba(0,0,0,0.5)",
    "3": "0 8px 24px rgba(0,0,0,0.6)"
  },

  "blur": {
    "subtle": 4,
    "modal":  8
  },

  "motion": {
    "duration": {
      "instant":   0,
      "fast":      150,
      "normal":    250,
      "slow":      400,
      "cinematic": 1500
    },
    "easing": {
      "standard": "cubic-bezier(0.4, 0, 0.2, 1)",
      "entry":    "cubic-bezier(0, 0, 0.2, 1)",
      "exit":     "cubic-bezier(0.4, 0, 1, 1)",
      "gentle":   "cubic-bezier(0.16, 1, 0.3, 1)",
      "ritual":   "cubic-bezier(0.65, 0, 0.35, 1)"
    },
    "entry": {
      "duration": 250,
      "easing":   "cubic-bezier(0, 0, 0.2, 1)"
    }
  },

  "subMode": {
    "editorial": {
      "typography.display.serif.enabled": true,
      "typography.heading.weight":        900,
      "typography.heading.tracking":      "-0.025em",
      "radius.default":                   8,
      "space.layout.padding":             24,
      "motion.entry.duration":            600,
      "motion.entry.easing":              "cubic-bezier(0.65, 0, 0.35, 1)",
      "elevation.1":                      "none"
    },
    "bento": {
      "color.bg.elevated":         { "oklch": "oklch(20% 0.010 30)", "hex": "#27221F" },
      "radius.default":            12,
      "space.layout.padding":      16,
      "elevation.1":               "0 1px 2px rgba(0,0,0,0.4), 0 2px 4px rgba(0,0,0,0.2)",
      "typography.heading.weight": 700
    },
    "quiet": {
      "color.bg.canvas":           { "oklch": "oklch(11% 0.005 30)", "hex": "#15110F" },
      "color.bg.surface":          { "oklch": "oklch(15% 0.006 30)", "hex": "#1E1916" },
      "color.text.primary":        { "oklch": "oklch(86% 0.005 60)", "hex": "#D8D1C7" },
      "color.text.secondary":      { "oklch": "oklch(60% 0.006 60)", "hex": "#928B81" },
      "typography.heading.weight": 600,
      "motion.entry.duration":     400,
      "motion.entry.easing":       "cubic-bezier(0.16, 1, 0.3, 1)"
    },
    "postcard": {
      "typography.display.serif.enabled": true,
      "motion.entry.duration":            1500,
      "motion.entry.easing":              "cubic-bezier(0.65, 0, 0.35, 1)",
      "color.bg.surface":                 { "oklch": "oklch(20% 0.012 30)", "hex": "#28221F" },
      "elevation.2":                      "0 6px 16px rgba(0,0,0,0.5), 0 2px 4px rgba(126,44,42,0.08)",
      "radius.pronounced":                16
    },
    "plate": {
      "radius.default":            6,
      "space.layout.padding":      16,
      "elevation.1":               "none",
      "typography.heading.weight": 700,
      "color.stroke.default":      { "oklch": "oklch(40% 0.008 30)", "hex": "#594E48" }
    }
  }
}
